handle,date,content,url,covid_1,covid_2,covid_3,covid_final,other_1,other_2,other_3,other_final
@dgvaladao,2020-04-14 19:45:30,I'm honored to have the @NRCC and so many incredible volunteers and donors supporting my campaign. The Central Valley is ready to fight for better representation in Congress for #CA21 https://t.co/cUVAMAVuLY,,FALSE,FALSE,FALSE,0,,FALSE,FALSE,0
@dgvaladao,2020-03-19 0:03:28,Donate if you can! https://t.co/LsPTDy7cny,,FALSE,FALSE,FALSE,0,,FALSE,FALSE,0
@dgvaladao,2020-03-03 23:47:54,Didn't even have to get out of my truck to return my ballot today! Make sure you vote before polls close at 8PM #CA21 https://t.co/E0F3Qornux,,FALSE,FALSE,FALSE,0,,FALSE,FALSE,0
@dgvaladao,2020-02-29 22:12:54,The Primary Election is just 3 days away and #TeamValadao is reminding voters to make it to the polls on Tuesday! #GOTV #CA21 https://t.co/oPsyne4ZDb,,FALSE,FALSE,FALSE,0,,FALSE,FALSE,0
@dgvaladao,2019-08-28 19:25:38,The Central Valley deserves a voice they can trust to represent them  – someone who listens and understands and has always fought to do what’s right. I’m ready and able to tackle the challenges we face and work day in and day out for the honor and privilege of serving you. https://t.co/illLGRQih6,,,,,,,,,
@dgvaladao,2018-11-07 7:32:50,This race is bigger than a candidate or political party. This race is about the those who make the Central Valley such an amazing place. The Valley has always been and will always be my home &amp; I’m beyond grateful for the opportunity to continue serving the place I love. https://t.co/m6btU3ZzvG,,,,,,,,,
@dgvaladao,2018-11-07 2:59:05,"There’s still time to cast your vote - polls close in one hour! Remember, if you’re in line by 8:00 PM you can still cast your ballot. #ElectionDay #CA21 https://t.co/zGVUwuMDAL",,,,,,,,,
@dgvaladao,2018-11-07 0:27:07,Thanks for the support from @SouthwestCarps! Make sure you get out and vote today. https://t.co/3X3LDEh5UR,,,,,,,,,
@dgvaladao,2018-11-06 20:17:26,There’s no better way to spend your lunch break🍴than making your voice heard on Election Day. Vote Valadao! https://t.co/1f2P2b7qBM,,,,,,,,,
@dgvaladao,2018-11-06 18:02:20,"Happy to cast my ballot for reliable water, good jobs, and quality schools. Thanks to the Kings County Elections office for making voting so accessible and convenient for CA-21 voters! 🗳 https://t.co/bV2R9ftSDN",,,,,,,,,
@dgvaladao,2018-11-06 17:12:22,"If you support Valley ag, a reliable water supply, and lower taxes vote David Valadao for Congress! #CA21 https://t.co/jjRgWzrOtp",,,,,,,,,
@dgvaladao,2018-11-06 14:31:29,Election Day is here and polls open in 30 minutes. 🇺🇸 Find your polling location here: https://t.co/Zvfq9Pt8qb #CA21 #Vote https://t.co/Fn3gDRVsly,,,,,,,,,
@dgvaladao,2018-11-05 18:03:23,"We're so happy to report that all of our campaign kittens have been adopted!

Thank you so much to our terrific interns and volunteers for welcoming them into their homes! https://t.co/lwL92pNfur",,,,,,,,,
@dgvaladao,2018-11-04 15:44:44,"Still holding on to your vote-by-mail ballot? 📬 Ballots must be postmarked by November 6. If you've already mailed your ballot, you can track its status here &gt; &gt; &gt; https://t.co/nNpgNSIs77 https://t.co/uliUQEWQdF",,,,,,,,,
@dgvaladao,2018-11-03 19:22:54,"Our interns were out walking precincts this morning in Hanford and rescued these cute, abandoned kittens.

A few might need a home. Have a contact for a rescue? Email us at info@valadaoforcongress.com https://t.co/swf75R9TZU",,,,,,,,,
@dgvaladao,2018-10-29 20:58:25,It’s pronounced VAL-UH-DAY-OH. https://t.co/n16X2jgb9s,,,,,,,,,
@dgvaladao,2018-10-27 18:31:33,We’re only ten days out from Election Day and Team Valadao is working harder than ever! 🇺🇸 #CA21 https://t.co/oVqnempgxN,,,,,,,,,
@dgvaladao,2018-10-26 19:32:02,"Our local elected officials play a pivotal role in our communities and earning their support is something I'm extremely proud of. This Election Day, the choice is clear. https://t.co/udpfdtrzLW",,,,,,,,,
@dgvaladao,2018-10-26 3:09:14,David Valadao is the proven leader we need to represent the Central Valley in Congress. 🇺🇸 https://t.co/Ct2y20yyg0,,,,,,,,,
@dgvaladao,2018-10-25 23:38:11,"Excited to debate the issues that matter most to our community tonight at 7:00 PM. Be sure to tune in to @KGETnews or @KSEE24!
https://t.co/D4F6RqqayR",,,,,,,,,
@dgvaladao,2018-10-24 16:02:12,"After years of struggling and fighting for our rightful water, we have reached a major accomplishment. The Executive Action signed last week will bring desperately needed water to our Valley communities. 

It is a new day for the Valley. https://t.co/vEvxmgxXjM",,,,,,,,,
@dgvaladao,2018-10-18 23:20:44,"Ensuring our law enforcement officers have the resources and tools needed to effectively and safely protect our communities and families is one of my top priorities. I'm proud to have the endorsement of the Fresno, Kern, Kings, and Tulare County Sheriffs. https://t.co/4XS36dAxrw https://t.co/Zzl4z2vehP",,,,,,,,,
@dgvaladao,2018-10-18 1:22:47,Vote my mail ballots are in mail boxes now! Don’t forget to send yours in today! https://t.co/ui78UmhpbQ,,,,,,,,,
@dgvaladao,2018-10-16 22:44:06,"As a small business owner, I’m incredibly proud to have the endorsement of the @USChamber, the @Fresno_Chamber, and the Greater Bakersfield Chamber of Commerce &gt; https://t.co/hFndgWT2tH https://t.co/5cOpJTUyh9",,,,,,,,,
@dgvaladao,2018-10-13 18:10:41,Team Valadao showed up in force to rally for the Triple Threat with @Vidak4Senate and @mendes_justin https://t.co/1oWiJiUwjk,,,,,,,,,
@dgvaladao,2018-10-12 22:22:43,"We appreciate all that our Valley farmers do, day in and day out. Because of you, the Central Valley leads the nation in agriculture production. Happy #NationalFarmersDay! 🚜 https://t.co/aSRkFUQ9BS",,,,,,,,,
@dgvaladao,2018-10-07 21:38:45,"Some of our very best volunteers are out putting up yard signs and making phone calls in our office! Join #TeamValadao today! 🇺🇸 
https://t.co/6Jr1jPBPdA https://t.co/LkMltLgGCo",,,,,,,,,
@dgvaladao,2018-10-06 19:24:39,"I’m proud to have received the endorsement of the @Bakersfieldcali, a most respected and trusted newspaper in the Central Valley. 🗞 
https://t.co/jPs5U8mL87",,,,,,,,,
@dgvaladao,2018-10-06 17:54:22,31 days to go: #TeamValadao is out in force today! 🇺🇸 https://t.co/gt4O6owbvz,,,,,,,,,
@dgvaladao,2018-10-04 23:48:16,Delivered another yard sign to a good home this week! Be sure to show your support and fill out the form so my team and I can drop one off! &gt; https://t.co/w7LVNb2D64 https://t.co/gYUrntxIh8,,,,,,,,,
@dgvaladao,2018-10-03 16:12:28,We're only 34 days from Election Day and we need your help getting the word out about our campaign. Request a yard sign now to show your support for David Valadao! https://t.co/BuZF1hefmT https://t.co/wiGUybbAci,,,,,,,,,
@dgvaladao,2018-09-17 18:37:12,"As the son of immigrants, today is a day of special pride. The contributions immigrants have made to our country in all fields cannot be overstated. By capturing the American Dream, they have helped further our country as the land of opportunity. https://t.co/Z7CjcylulD",,,,,,,,,
@dgvaladao,2018-09-17 18:35:51,"On this day 231 years ago, the United States adopted the supreme law of the land: The Constitution. https://t.co/n50VJUm9dZ",,,,,,,,,
@dgvaladao,2018-09-12 18:02:58,"The Central Valley has been my home for my entire life and is where my family lives today. I will continuing fighting for a reliable water, supply protecting our veterans, and making education affordable for our communities.

Check out our first TV ad: https://t.co/nPNCjT0Hh4",,,,,,,,,
@dgvaladao,2018-09-11 17:16:30,A lot of first time donor stickers too! https://t.co/CgK0n7KOQO,,,,,,,,,
@dgvaladao,2018-09-11 13:43:18,"Today, as always, we will never forget those lives lost on that tragic day 17 years ago. https://t.co/k0nTkibbRV",,,,,,,,,
@dgvaladao,2018-08-10 20:43:06,"Farming families want results in Congress. 

That's why I will continue to fight for real solutions to deliver water, cut red tape, and make it easier for our farmers to feed the world.

Read the letter in the Hanford Sentinel: https://t.co/EwOB34xqa8 https://t.co/KoI0VVM6yi",,,,,,,,,
@dgvaladao,2018-07-30 22:45:05,"99 days until #CA21 can vote to keep lower taxes, increased take-home pay, newly-created jobs, and fight for the water we deserve! https://t.co/AtzBbgO0FK",,,,,,,,,
@dgvaladao,2018-07-04 16:35:04,"On this Fourth of July, we celebrate the courage of our founding fathers and the countless men and women who have sacrificed to protect our liberty. https://t.co/IYJEnWvMX2",,,,,,,,,
@dgvaladao,2018-06-26 20:55:32,Sacramento's gas tax has punished the most vulnerable among us. Valley families can't afford Sacramento's policymaking. That's why I've fought to ensure Central Valley families can keep more of their hard-earned dollars with the #TaxCutsAndJobsAct. https://t.co/HR8D1Xh25l,,,,,,,,,
@dgvaladao,2018-06-05 16:02:27,"Polls are open across #CA21! 

SHARE and get out the vote: https://t.co/VZZOtlQVfC",,,,,,,,,
@dgvaladao,2018-05-29 15:23:41,Super Saturday was a huge success. Email info@valadaoforcongress.com to join us next week! https://t.co/XuyoWfAbAr,,,,,,,,,
@dgvaladao,2018-05-21 23:44:00,It’s a full house at Valadao HQ! Come and lend a hand before the primary! Email info@valadaoforcongress.com for more info! https://t.co/Fv9paYn37l,,,,,,,,,
@dgvaladao,2018-04-24 18:04:02,"Hot off the press and coming soon to a yard near you! 

Still need a yard sign? Request one here ➡️ https://t.co/mOL8XL2FEJ https://t.co/vILXghn9s0",,,,,,,,,
@dgvaladao,2018-04-24 13:38:13,"Congratulations to Lemoore Middle College High School who won the U.S. Academic Decathlon Division 4 Championships! Good work, team! STORY: https://t.co/YbrcPkzVTA https://t.co/PgrKTSP6PG",,,,,,,,,
@dgvaladao,2018-04-12 14:07:27,"With just 53 days till the 2018 California Primary, our team needs your help. Sign up today to join our team!

👉 https://t.co/7cBgbojSXK https://t.co/cNU2332RNA",,,,,,,,,
@dgvaladao,2018-03-18 2:58:01,Congrats Lady Bears!! That was a great game! https://t.co/nC0KbI9B81,,,,,,,,,
@dgvaladao,2018-02-12 22:55:30,"Today, I declared my candidacy and submitted my nomination papers for California's Twenty First Congressional District. It is an honor to serve you in Congress. #CA21 https://t.co/5JNgljeBDP",,,,,,,,,
@dgvaladao,2017-12-25 15:19:22,"From our family to yours, Merry Christmas! https://t.co/kz9mC7TWGB",,,,,,,,,
@dgvaladao,2017-11-14 19:16:08,Enjoyed debating #California vs. #Wisconsin Dairy with @Duffy4Wisconsin last week: https://t.co/udOtqhEcri,,,,,,,,,
@dgvaladao,2017-01-24 3:42:26,Congrats to my friend @RepMikePompeo! I always knew he would make a great spy! https://t.co/lntWhjkixO,,,,,,,,,
@dgvaladao,2016-11-13 0:31:16,"Election Day may have come and gone, but some yard signs still remain! Email info@valadaoforcongress.com location so we can pick them up! https://t.co/jWLO01TK3L",,,,,,,,,
@dgvaladao,2016-11-09 20:40:44,I will always be humbled by the incredible support I receive from the Valley and am honored to have the opportunity to serve again. https://t.co/vJySQ6ejuI,,,,,,,,,
@dgvaladao,2016-11-08 23:57:43,"After casting your vote, be sure to stop by our Election celebration tonight in Hanford! https://t.co/cfqWF4ayTR",,,,,,,,,
@dgvaladao,2016-11-08 17:13:10,SHARE if your voting for David Valadao today! #VoteValadao #CA21 #559vote #661vote https://t.co/qwf6frhiXs,,,,,,,,,
@dgvaladao,2016-11-08 17:05:20,Election Day is here and the polls are open till 8:00 PM!  Find your polling place here: https://t.co/O01brKfnMW #VoteValadao #CA21 https://t.co/T51KRbDdEI,,,,,,,,,
@dgvaladao,2016-11-07 22:45:46,One day until Election Day! Are you voting tomorrow? #CA21 #559vote #661vote https://t.co/wlkfDAbsRj,,,,,,,,,
@dgvaladao,2016-11-07 18:16:08,Meeting with volunteers in our #Bakersfield campaign headquarters this morning. Can't say enough great things about this group! #661vote https://t.co/vds3eBTsBR,,,,,,,,,
@dgvaladao,2016-11-06 20:50:48,"I'm proud of the local support I have earned from our community. This Election Day, the choice is clear. #CA21 #559vote #661vote https://t.co/bcgXRdfBzi",,,,,,,,,
@dgvaladao,2016-11-06 18:29:28,I've worked hard to ensure every child has access to the best education possible &amp; am proud to have the support of the @cta &amp; @NEAToday. https://t.co/a4PHNPhfli,,,,,,,,,
@dgvaladao,2016-11-06 17:44:17,Election Day is ONLY two days away! Are you ready to vote? #559vote #661vote #CA21 #VoteValadao https://t.co/J3buiKJi9j,,,,,,,,,
@dgvaladao,2016-11-05 19:16:45,Super Saturday is underway. Volunteers are working hard getting people to the polls to cast their vote! #CA21 #TeamValadao https://t.co/WHyL3bKiJP,,,,,,,,,
@dgvaladao,2016-11-05 19:12:45,We are only three days from Election Day! Call (559) 639-7262 to find out how you can get involved this weekend! https://t.co/ki6Kh1kVL2,,,,,,,,,
@dgvaladao,2016-11-05 1:15:06,"As a lifelong resident of Hanford, earning the support of Kings Co. elected officials means the world to me. LIST: https://t.co/AzITSRa57o https://t.co/XYlPTi9hFT",,,,,,,,,
@dgvaladao,2016-11-04 23:06:59,Fresno Co. is home to some of the most dedicated public servants in CA &amp; I'm honored to have their support. List: https://t.co/fpMiHfXZ78 https://t.co/1bhTTjMpwV,,,,,,,,,
@dgvaladao,2016-11-04 20:34:59,Support from Kern Co. is critical to my work in DC. I'm proud to have the endorsement of these great leaders. LIST: https://t.co/Wtw4Hbt5BW https://t.co/zzIK0Thxg0,,,,,,,,,
@dgvaladao,2016-11-04 19:41:34,Only four days until Election Day! Have you voted yet? #559vote #661vote #CA21 https://t.co/mnbNH2klgF,,,,,,,,,