date,content,covid_1,covid_2,covid_3,covid_final,other_1,other_2,other_3,other_final
2020-04-20 16:06:58,"Universal access to affordable healthcare for all. Investments in education, infrastructure &amp; clean energy. Affordable childcare &amp; paid family leave to support our working families. The urgency of what we are fighting for is more important than ever. #NY24
https://t.co/prpafg8VaJ",FALSE,FALSE,,0,FALSE,FALSE,,0
2020-04-19 17:16:34,"Message of the day - get our running shoes on and get ready to run. That’s exactly what #TeamConole is doing this weekend with our virtual Weekend of Action to flip #NY24 blue!

Sign up to join us in dialing 📞 today ———-&gt; https://t.co/oL5BEZhLn3 https://t.co/01nJNDg6QX",FALSE,FALSE,,0,FALSE,FALSE,,0
2020-04-18 20:16:08,Join our Weekend of Action and talk to voters across NY24 - our volunteers are up and at 'em on this beautiful Saturday! Sign up here to get involved: https://t.co/oL5BEZhLn3,FALSE,FALSE,,0,FALSE,FALSE,,0
2020-04-18 13:40:40,"A beautiful story by Sean Kirst on Dr. Stephen Thomas &amp; the pain &amp; importance of confronting grief. Dr. Thomas is an Army veteran, Chief of Infection Disease, &amp; is leading the #COVID19 Incident Command at Upstate. Thank you Dr. Thomas for your work. #NY24

https://t.co/vBDvxHMw4R",FALSE,FALSE,,0,FALSE,FALSE,,0
2020-04-17 21:23:12,"Thank you everyone for joining another Conole on Your Computer virtual event! Special thanks to @joedriscoll315 for being a part of our discussion on how we beat #COVID19 &amp; move #NY24 forward.

RSVP for next week with Assemblywoman Pamela Hunter!

➡️ https://t.co/uSsn58PwZ5 ⬅️ https://t.co/G93IJZS1OE",FALSE,FALSE,,0,FALSE,FALSE,,0
2020-04-17 16:03:19,"Happy Friday everyone! This morning I'm out delivering food in #NY24. Then I hope everyone can join us later today for Conole On Your Computer at 4pm -----&gt; https://t.co/uSsn58PwZ5

Have a wonderful day and remember to stay safe and healthy. https://t.co/lDheyeUCDg",FALSE,FALSE,,0,FALSE,FALSE,,0
2020-04-16 21:05:10,"Thank you Shanelle &amp; Todd Reid for having me on the Syracuse Virtual Townhall! Wonderful discussion on how we will beat #COVID19 &amp; move #NY24 forward.

Make sure to signup &amp; join us for Conole On Your Computer tomorrow with special guest @joedriscoll315

➡️https://t.co/uSsn58PwZ5 https://t.co/ivYxvpuP7y",FALSE,FALSE,,0,FALSE,FALSE,,0
2020-04-16 17:06:42,"#TeamConole is looking to expand! If you or anyone you know is interested in joining the team as a field intern, please have them send their resume to info@conoleforcongress.com. Thank you in advance! Hope you’re all staying safe and healthy. #NY24 https://t.co/RnxqK1MkR3",FALSE,FALSE,,0,FALSE,FALSE,,0
2020-04-16 14:15:19,"Excited to kick off this morning with the launch of our new campaign website! Take a minute to read all about the priorities we are fighting for here in #NY24, our incredible team of endorsements, and how you can join our mission today!

https://t.co/4sy5Et6SAT",FALSE,FALSE,,0,FALSE,FALSE,,0
2020-04-15 15:17:25,"Today marks the 1-year anniversary of launching our campaign! To our supporters &amp; volunteers &amp; to all of the people of CNY, thank you - the past year has been the honor of my life. The urgency of what we are fighting for has become even more dire. Onward  🇺🇸 #NY24 https://t.co/gt2Iu7tbYe",FALSE,FALSE,,0,FALSE,FALSE,,0
2020-04-14 21:26:14,"The #COVID19 crisis has given us an even greater appreciation for the work our teachers do everyday. Thank you to all of our educators who go above and beyond. From Ontario to Syracuse, the strength of our teachers &amp; public schools will determine our future. #NY24 https://t.co/mYsV9Zl9Ib",FALSE,FALSE,,0,FALSE,FALSE,,0
2020-04-13 23:19:55,"“Conole on your Corner,” a face-to-face grassroots effort, has now become “Conole on your Computer,”. 

“People want to be heard, people want to know that there is a community of strong leaders that they can connect with,” said Conole. #NY24 

https://t.co/YHOiJkx9kO https://t.co/uUhDzkRZVL",FALSE,FALSE,,0,FALSE,FALSE,,0
2020-04-13 20:22:59,"From serving on the ground in Iraq to advising the Secretary of Defense at the Pentagon I learned key lessons that can be applied to confronting the unprecedented public health &amp; economic emergency due to the #COVID19 pandemic. #NY24

Read more in my op-ed
https://t.co/hfTItFr3Ad",FALSE,FALSE,,0,FALSE,FALSE,,0
2020-04-13 15:35:17,"The Trump administration might not understand that seniors rely on the postal service for medication &amp; our rural communities rely on it for package delivery, but anyone in #CNY can tell them how disastrous losing the postal service would be. #NY24

https://t.co/4wOIfbiA2u",FALSE,FALSE,,0,FALSE,FALSE,,0
2020-04-12 14:41:42,"Wishing everyone a Happy Easter and Joyous Passover! But even if you are not celebrating a holiday this weekend, it is a wonderful time to reflect, give thanks, and remember the powerful message of hope. https://t.co/2V5bZTu8q7",FALSE,FALSE,,0,FALSE,FALSE,,0
2020-04-11 12:30:30,Our Upstate nurses arrived this week in Long Island to help confront the worst of the #COVID19 crisis. Look at the reception they received from their fellow warriors on the frontlines. #NEWYORKTOUGH #UPSTATESTRONG 💪🇺🇸 https://t.co/2m16sHmf2j,FALSE,FALSE,,0,FALSE,FALSE,,0
2020-04-10 21:20:28,"Thank you everyone for joining Conole On Your Computer! Amazing turnout &amp; discussion on challenges families are confronting during this #COVID19 crisis.

Next week our special guest will be Syr Councilor &amp; Musical Legend @joedriscoll315! #NY24

RSVP here: https://t.co/Pq0Wvb2swY https://t.co/oNF8O4COUN",FALSE,FALSE,,0,FALSE,FALSE,,0
2020-04-10 15:47:35,"Exciting day on the virtual campaign trail in #NY24. Just finished an interview with @karenaguilar_92 at @SPECNewsCNY.

Later today we have a Conole On Your Computer virtual event. Sign up to join here: https://t.co/Pq0Wvb2swY https://t.co/uVx0w3L3lx",FALSE,FALSE,,0,FALSE,FALSE,,0
2020-04-10 12:24:27,"Good morning everyone! On #NationalSiblingsDay, I’d like to say how grateful I am for my brother Kevin. He is loving, kind, a great role model &amp; continues to serve our country at NASA. I am looking forward to having him join us for this afternoon’s Conole On Your Computer! #NY24 https://t.co/A9ZjcH1IuZ",FALSE,FALSE,,0,FALSE,FALSE,,0
2020-04-09 17:05:44,"Special announcement in #NY24 for Conole on Your Computer! 

Sign-up &amp; join #TeamConole tomorrow at 4pm ----------&gt; https://t.co/Pq0Wvbk3ow https://t.co/HD6GvR4Cps",FALSE,FALSE,,0,FALSE,FALSE,,0
2020-04-09 13:39:54,Syracuse lost a treasure yesterday when Elijah Harris Jr. was tragically killed in a hit and run. Eli shared so much and brought joy to so many. Please consider supporting Eli’s family during this difficult time:  https://t.co/wKEysoEFeG,FALSE,FALSE,,0,FALSE,FALSE,,0
2020-04-08 17:33:22,"In 2020, Congress must support a national vote-by-mail program so that every American can have their voice heard. No one should be forced to choose between their health and their voice being heard. #NY24 

https://t.co/vWJBHDldQy",FALSE,FALSE,,0,FALSE,FALSE,,0
2020-04-08 15:22:36,Want to start the day with a thank you to all of those risking their lives on the front lines everyday of the #COVID19 crisis. We are grateful for your service. Stay healthy. #NY24 https://t.co/JO5SPH2A3U,FALSE,FALSE,,0,FALSE,FALSE,,0
2020-04-07 23:03:16,"During this time, it is especially difficult for families to lose a loved one. This past week one of our very close family friends died after a long battle with cancer. Rocky was one of the most loving people I have known.  Let’s remember those facing loss during this tough time. https://t.co/PV1LWbNVs6",FALSE,FALSE,,0,FALSE,FALSE,,0
2020-04-07 19:07:39,"Acting SecNav Modly showed an abhorrent lack of leadership in his disparaging remarks to the crew of the TR. Our nation is facing a serious crisis in #COVID19 &amp; we need leaders who will unify, not cause further pain &amp; division. A/SecNav Modly needs to resign immediately. #NY24",FALSE,FALSE,,0,FALSE,FALSE,,0
2020-04-07 14:44:03,"Our country is facing a crisis the scales of which we have not seen in over 100 years. With the power of American ingenuity &amp; an immeasurable capacity for human kindness we, both as a #NY24 community &amp; a country, will beat #COVID19

Read more in my op-ed:
https://t.co/hfTItF9sbD",FALSE,FALSE,,0,FALSE,FALSE,,0
2020-04-06 14:44:37,"Very excited for Conole on Your Computer this Friday with special guest - my baby brother - Kevin Conole!

Sign up to join our discussion on childcare during the #COVID19 crisis, and get an update from the virtual campaign trail in #NY24 ---&gt; https://t.co/oL5BEZhLn3 https://t.co/KWoMyNF2ys",FALSE,FALSE,,0,FALSE,FALSE,,0
2020-04-03 22:57:17,"🚨Endorsement Alert🚨

Proud to earn the endorsement of @TTHpac! Our country faces an unprecedented public health and economic crisis. It’s time for veteran leadership to step up and deliver real results for the American people. #NY24 https://t.co/j9RreDNTQg",FALSE,FALSE,,0,FALSE,FALSE,,0
2020-04-03 21:57:24,"Thank you @MissoForCNY  for your commentary on the extremely unfortunate firing of CAPT Crozier, who was fulfilling his ultimate command responsibility of protecting his ship &amp; crew. If you haven’t seen it, the send-off the crew gave him is awe-inspiring.

https://t.co/j6P6CM5mqo",FALSE,FALSE,,0,FALSE,FALSE,,0
2020-04-03 19:00:18,"Conole on Your Corner is now Conole on Your Computer! 

Join us next week to discuss childcare &amp; the challenges parents are confronting during the #COVID19 crisis. 

Special guests: my baby bro, super-dad, father of 4, Kevin Conole! 

Sign up to join us: https://t.co/oL5BEZhLn3 https://t.co/RveuxdNWZP",FALSE,FALSE,,0,FALSE,FALSE,,0
2020-04-02 15:27:34,"This is infuriating and unacceptable. Small businesses, both here in central New York and across the country, are depending on financial support during this national crisis to stay afloat. Washington politicians need to do their job and fix this.

https://t.co/miZ1CJNbEv",FALSE,FALSE,,0,FALSE,FALSE,,0
2020-04-01 21:46:13,"Today is #NationalCensusDay! Don’t forget to take a few minutes out of your evening to submit your 2020 census. It’s critical to making sure our community gets the funding it needs for so many important programs &amp; services.
https://t.co/yALwsdwz93",FALSE,FALSE,,0,FALSE,FALSE,,0
2020-04-01 17:48:38,"""This is outrageous. Seniors on Social Security should not be burdened to completely unnecessary tasks to receive financial relief. Washington need to start understanding that real people are feeling real &amp; awful effects from this crisis &amp; need help NOW.""
https://t.co/dR1dUF6GGY",FALSE,FALSE,,0,FALSE,FALSE,,0
2020-03-31 21:23:34,"#TeamConole - we want to quickly interrupt your evening of puzzling with a reminder that our first financial quarter deadline of the year is TONIGHT at midnight!

Help chip in the final donation pieces we need to hit our goal and flip #NY24 blue!

https://t.co/ldes8C2yos https://t.co/aJF1m094Nv",FALSE,FALSE,,0,FALSE,FALSE,,0
2020-03-31 19:10:44,"This #EqualPayDay shows we are still embarrassingly behind where our country should be. Overall, women only make 81.6 cents for every dollar a man makes. We must take action and that starts by passing the Paycheck Fairness Act. #NY24 

https://t.co/9eS8YUtZW3",FALSE,FALSE,,0,FALSE,FALSE,,0
2020-03-31 13:50:01,"""Especially as we are facing one of the greatest challenges in our country in recent history, we need proven leaders like Francis who know how to overcome tough circumstances &amp; deliver results that always put people first.""  - Jon Soltz, @votevets. #NY24

https://t.co/NeZOV6e9uR",FALSE,FALSE,,0,FALSE,FALSE,,0
2020-03-30 23:05:41,"On #NationalDoctorDay let's give a special thank you to all the doctors, as well as nurses, scientists, and first responders, on the frontlines of the #COVID19 crisis. Best way you can do that today is by continuing to practice #socaildistancing",FALSE,FALSE,,0,FALSE,FALSE,,0
2020-03-30 17:39:41,"Honored to be endorsed by @defendvoting. I've proudly defended our democratic values &amp; institutions as a Senior Naval Officer, Iraq War Veteran &amp; Pentagon policy advisor &amp; I'm dedicated to working everyday in Congress to protect the voice of the American people. #NY24 https://t.co/Ehwyr8tpnk",FALSE,FALSE,,0,FALSE,FALSE,,0
2020-03-28 16:34:16,"Want to get involved in our mission to flip #NY24 🔴➡️🔵 right from the comfort of your 🛋?

Sign up today!
https://t.co/oL5BEZhLn3 https://t.co/nm9r4MbwWz",FALSE,FALSE,,0,FALSE,FALSE,,0
2020-03-28 14:06:01,Good morning Syracuse! One of my favorite sights from my morning run. We’ve faced tough times before and we will get through this together🍊💪 #NY24 https://t.co/QqsSqvBsJS,FALSE,FALSE,,0,FALSE,FALSE,,0
2020-03-27 15:12:58,"These are the heroes on the front lines of our war against #COVID19. We need to support our doctors, nurses, scientist, and first responders the same way we support our frontline military during a conflict. #NY24 https://t.co/EeqGhUqzgH",FALSE,FALSE,,0,FALSE,FALSE,,0
2020-03-26 22:14:18,".@Beakandskiff has been an icon in CNY for over 100 years. I’m very proud to see them stepping up to help during the #COVID19 crisis. I have great memories marching in the Memorial Day Parade with Eddie’s grandfather Marshall a decorated WWII veteran #NY24
https://t.co/jv0X8AMDPq",FALSE,FALSE,,0,FALSE,FALSE,,0
2020-03-26 18:00:08,"IMPORTANT MESSAGE - To support uninsured individuals &amp; families during the #COVID19 crisis, @NYStateofHealth has opened the health exchange for a special enrollment period until April 15th.

Click the link below to get started today!
https://t.co/3Xosuqk52k

#ProtectOurCare #NY24",FALSE,FALSE,,0,FALSE,FALSE,,0
2020-03-26 15:21:10,"🚨Endorsement Alert🚨

I've dedicated my life to serving, protecting &amp; defending our country under the most challenging circumstances. I'm honored to earn the endorsement of @votevets &amp; look forward to bringing forth new leadership that delivers real results for #NY24 https://t.co/3tvIeTssKX",FALSE,FALSE,,0,FALSE,FALSE,,0
2020-03-25 23:11:40,Practicing #SocialDistancing while picking up some of the best pizza on the planet! Ronnie Ross leaves behind a great legacy in the Twin Trees restaurants. 🍕 #NY24 https://t.co/vCuVBZRRLU,FALSE,FALSE,,0,FALSE,FALSE,,0
2020-03-25 20:03:14,"Can't figure out what to eat this evening? Support one of our local restaurants by ordering takeout or delivery. I’ll be ordering some of the best pizza in CNY - Twin Trees!

https://t.co/0nw8WTA67M",FALSE,FALSE,,0,FALSE,FALSE,,0
2020-03-24 17:03:32,Very proud of my mother who went back to school in her 50s to earn her teaching certification. My dad sent me this picture of her tutoring remotely today. Special thank you to all our teachers who continue finding creative ways to educate our children during the #COVID19 crisis. https://t.co/R1fGLFo2TY,FALSE,FALSE,,0,FALSE,FALSE,,0
2020-03-24 15:38:15,"This national crisis requires real leadership &amp; action.

We need #COVID19 tests.
We need ventilators &amp; hospital beds.
We need protective masks for health care workers.
We need paid sick leave for working people.
We need economic relief for small businesses and working families.",FALSE,FALSE,,0,FALSE,FALSE,,0
2020-03-24 0:59:20,Let’s close the evening on a bright note. Happy #NationalPuppyDay from Canines for Conole! https://t.co/omKmIfoBkJ,FALSE,FALSE,,0,FALSE,FALSE,,0
2020-03-23 21:42:08,"10 years later the #ACA continues to be a landmark achievement. Now more than ever, it is critical we continue to #ProtectOurCare &amp; build on it to achieve universal, affordable health care for all. https://t.co/uoadQZTMOB",FALSE,FALSE,,0,FALSE,FALSE,,0
2020-03-23 14:13:28,"This is an inspiring story about the character of CNYers to help in a time of crisis. But it's infuriating that the federal government has failed in ensuring our healthcare workers have even the most basic protective gear. This is completely unacceptable.

https://t.co/Vr8DbtAI6l",FALSE,FALSE,,0,FALSE,FALSE,,0
2020-03-22 17:06:44,"As we head into a new week and work to prevent the spread of #COVID19, let’s remember the lesson of my doctor on the USS Wasp and follow the top recommendation of the CDC - wash your hands as often as possible. https://t.co/IGRoNdInPp",FALSE,FALSE,,0,FALSE,FALSE,,0
2020-03-21 17:36:05,"Thank you doctors, nurses, &amp; healthcare professionals for your work on the front lines of the #COVID19 crisis &amp; for keeping our communities safe. That includes my cousin Margaret Corbett, who is working everyday as a nurse. Together, we will beat this.

https://t.co/7vyD7hMFMK",FALSE,FALSE,,0,FALSE,FALSE,,0
2020-03-21 0:28:02,"Join #TeamConole in preventing the spread of #COVID19 &amp; practicing social distancing by tuning into my friend, @joedriscoll315 Facebook Live Concert tonight.

https://t.co/85gWS6wFby https://t.co/akeccfpbDW",FALSE,FALSE,,0,FALSE,FALSE,,0
2020-03-20 20:33:31,"We need proven leadership in gov't that delivers results for hard working people &amp; families. I'm proud to have grown up in CNY &amp; served as an Iraq War Vet &amp; Pentagon policy advisor. Today, I'm honored to submit nearly 5,000 signatures to place my name on the ballot to serve #NY24 https://t.co/CxwnnH8BKC",FALSE,FALSE,,0,FALSE,FALSE,,0
2020-03-20 15:03:50,"Serving at the Pentagon I knew receiving classified material was a coveted trust not to be used for personal gain. Instead of acting to protect Americans, career DC politicians used their advance notice of #COVID19 to personally profit. This is outrageous.
https://t.co/0VhXbBePdr",FALSE,FALSE,,0,FALSE,FALSE,,0
2020-03-19 17:58:07,Wanted to take a minute to say hello and talk more about taking care of our mental and emotional health. https://t.co/6nZs0Ey39s,FALSE,FALSE,,0,FALSE,FALSE,,0
2020-03-19 14:57:25,"While we continue to work together to prevent the spread of #COVID19 &amp; #FlattenTheCurve by practicing #SocialDistancing, it is also just as important that everyone takes care of their mental &amp; emotional health during this crisis.

https://t.co/E7zXgWyfB6",FALSE,FALSE,,0,FALSE,FALSE,,0
2020-03-18 21:24:12,"Americans across the country are coming together to beat #COVID19. While I'm glad Families First Act finally passed, our country needs real leadership that will act quickly &amp; pass paid sick leave &amp; support millions facing financial hardship in this crisis.
https://t.co/cpYT7NCxRS",FALSE,FALSE,,0,FALSE,FALSE,,0
2020-03-18 18:59:44,"The Navy always answers the call to service. Proud to see my fellow sailors preparing the USNS Comfort &amp; USNS Mercy (two of our finest hospital ships) to help increase capacity &amp; treat #COVID19. Americans working together is how we will beat this. 

https://t.co/rBq3AqRMyz",FALSE,FALSE,,0,FALSE,FALSE,,0
2020-03-17 19:15:52,"Paid sick leave should already be a fundamental right. Now during the #COVID19 crisis, we need it more than ever to save lives &amp; alleviate workers. Time for Congress to put politics aside &amp; build on this first round to deliver results for all Americans.

https://t.co/rycNvuhoyi",FALSE,FALSE,,0,FALSE,FALSE,,0
2020-03-17 14:32:04,"Though we will not be celebrating this year in the traditional way, I'm celebrating from home by reminiscing of years past. In 1986 my grandfather had the honor of being the grand marshal of the parade with Mayor Tom Young. Happy St. Patrick’s Day &amp; stay safe &amp; healthy!🍀 https://t.co/usmrH3YakC",FALSE,FALSE,,0,FALSE,FALSE,,0
2020-03-16 17:16:50,"Taking a minute to connect with you to talk about #COVID19. 

In America's history, we have gone through and overcome so many difficult challenges. And I know that working together, we can overcome this one as well. https://t.co/laWOilZhGg",FALSE,FALSE,,0,FALSE,FALSE,,0
2020-03-15 23:11:43,"Really good article on how outbreaks like #COVID19 spread &amp; what we can do to ""flatten the curve."" 

We should continue to remain calm &amp; follow the recommendations of public health officials, scientists &amp; the @CDCgov to stay healthy &amp; prevent the spread.

https://t.co/oXEkyLMUUh",FALSE,FALSE,,0,FALSE,FALSE,,0
2020-03-14 23:26:15,"To do our part in stopping the spread of #COVID19 &amp; ensure the health &amp; safety of our volunteers &amp; community, our campaign is postponing events &amp; closing our office.

Want to volunteer virtually? Sign up here: https://t.co/Cm0sG2un2U

And for up-to-date info - follow @CDCgov",FALSE,FALSE,,0,FALSE,FALSE,,0
2020-03-14 15:30:53,"Now that Families First #COVID19 Response Act passed the House, the Senate must act
➡️Paid sick leave for public health emergencies
➡️Coverage for testing &amp; waives cost sharing
➡️Food asst. to local food banks, meals outside school &amp; vulnerable communities
https://t.co/XADoDgt3ex",FALSE,FALSE,,0,FALSE,FALSE,,0
2020-03-13 20:05:11,"As the #COVID19 situation continues to evolve, I want to thank all the doctors, nurses, &amp; first responders who are leading the effort to keep our communities safe &amp; healthy.

I encourage everyone to continue following @CDCgov guidance to protect yourself &amp; others. https://t.co/bpzuJ7XY9f",FALSE,FALSE,,0,FALSE,FALSE,,0
2020-03-13 15:30:05,"Thank you, @Misso4Congress for the passion &amp; commitment to service that you brought everyday to the campaign trail. You've made our primary stronger &amp; I know you will continue to be an inspiring voice in the fight to beat Katko, &amp; build a brighter future for the people of #NY24 https://t.co/1qu90o3ZoM",FALSE,FALSE,,0,FALSE,FALSE,,0
2020-03-12 13:39:15,"As we follow recommendations from @CDCgov, Congress needs to pass Families First #COVID19  Response Act:
➡️Paid sick leave for public health emergencies.
➡️Coverage for testing &amp; waives cost sharing.
➡️Food asst. to local food banks, meals outside school &amp; vulnerable communities.",FALSE,FALSE,,0,FALSE,FALSE,,0
2020-03-11 22:12:45,"With the #COVID19 situation evolving, I encourage everyone to stay updated with accurate info on how to protect yourself &amp; others @CDCgov
♦️ Wash hands often with soap for 20 secs or more
♦️ Avoid touching your face
♦️ Disinfect surfaces frequently touched
https://t.co/oGKnEpSQBC",FALSE,FALSE,,0,FALSE,FALSE,,0
2020-03-11 14:53:17,"It's been a year since the House passed the #ForThePeople Act, yet Mitch McConnell refuses to bring it to a vote. 

I'm running to get big money &amp; special interests out of our government. That's why I'm proud to have taken the No Corporate PAC pledge. 

https://t.co/0uvrbHD3fV",FALSE,FALSE,,0,FALSE,FALSE,,0
2020-03-10 18:32:59,"On the 10 year anniversary of passing the Affordable Care Act, let's stay committed to #ProtectOurCare and the fundamental right that everyone should have access to quality affordable health care and prescription drugs. https://t.co/MZ92KPjg01",FALSE,FALSE,,0,FALSE,FALSE,,0
2020-03-10 14:52:40,"As we continue to follow @CDCgov recommendations for preventing the #COVID2019 from spreading, let's remember why we need a national paid family &amp; medical sick leave program. No one should have to choose between getting healthy &amp; getting their paycheck. https://t.co/XT8o5OhfkL",FALSE,FALSE,,0,FALSE,FALSE,,0
2020-03-09 18:18:49,"🚨Endorsement Alert🚨

In addition to her lifelong dedication to service as a decorated U.S. Army veteran &amp; community leader, Assemblywoman Hunter is an inspiration &amp; trailblazer as the only female veteran to serve in the NYS Legislature. I'm honored she is onboard #TeamConole! https://t.co/2xqVIV8fHw",FALSE,FALSE,,0,FALSE,FALSE,,0
2020-03-09 15:16:55,Remember to continue checking the @CDCgov website for up to date information as well as how you can help prevent the spread. ⬇️ https://t.co/XT8o5NZEtd,FALSE,FALSE,,0,FALSE,FALSE,,0
2020-03-08 17:09:07,On #InternationalWomensDay we reflect on the challenges extraordinary women have overcome in the push for progress &amp; remember it's all of our responsibility to stand up in the continued fight for equality. And a special thank you to all the amazing women who inspire me every day https://t.co/iiGgGo77Rv,FALSE,FALSE,,0,FALSE,FALSE,,0
2020-03-06 20:32:14,"ICYMI - ""Gallego, an AZ Democrat, is the 2nd current or former member of Congress who is also an Iraq War veteran to endorse Conole for Congress. Former U.S. Rep Patrick Murphy, who was the 1st Iraq War vet elected to Congress, endorsed Conole last year.""

https://t.co/urHCcUP18I https://t.co/4Vx048enL9",FALSE,FALSE,,0,FALSE,FALSE,,0
2020-03-06 17:07:25,"Another big Weekend of Action starts tomorrow for #TeamConole!
1️⃣ Sign up - https://t.co/J172VJCBPH
2️⃣ Snap a selfie!
3️⃣ Help turnout the vote for Francis Conole in NY-24! https://t.co/wxKbtTm69E",FALSE,FALSE,,0,FALSE,FALSE,,0
2020-03-06 14:54:03,"NY-24:
🚨1 of 3 seats still held by a Republican that Hillary won
🚨The (R) endorsed Donald Trump
🚨DEVIN NUNES is headlining a $1,000 A PLATE fundraiser
Let’s show what happens when grassroots supporters get pissed off. Retweet &amp; consider chipping in $10! https://t.co/psb4uq8NJc",FALSE,FALSE,,0,FALSE,FALSE,,0
2020-03-05 20:38:20,"""..... And we launched this campaign to take on corruption and to get big money and special interests out of our government; money that corrupts our politics so badly that it literally obstructs almost everything we’re talking about on this campaign."" https://t.co/ywjD5d4JSf",FALSE,FALSE,,0,FALSE,FALSE,,0
